{
  "$schema": "http://json-schema.org/draft-07/schema#",
  "$id": "connections.schema.json",
  "title": "Dataverse Connection Config",
  "description": "Schema for validating the connections JSON files used by the Dataverse refresh pipeline",
  "type": "array",
  "minItems": 1,
  "items": {
    "type": "object",
    "required": ["URL", "AKV", "Username", "SecretName"],
    "additionalProperties": false,
    "properties": {
      "URL": {
        "type": "string",
        "format": "uri",
        "pattern": "^https://[a-zA-Z0-9-]+\\.crm[0-9]*\\.dynamics\\.com$",
        "description": "Dataverse org URL. Must be HTTPS and a valid dynamics.com CRM endpoint.",
        "examples": ["https://contoso.crm.dynamics.com", "https://contoso.crm4.dynamics.com"]
      },
      "AKV": {
        "type": "string",
        "minLength": 3,
        "maxLength": 24,
        "pattern": "^[a-zA-Z][a-zA-Z0-9-]*$",
        "description": "Azure Key Vault name (not the full URI, just the vault name).",
        "examples": ["kv-d365-prod", "kv-dataverse-dev"]
      },
      "Username": {
        "type": "string",
        "format": "email",
        "description": "Service account UPN used to authenticate to Dataverse.",
        "examples": ["svc_d365@contoso.onmicrosoft.com"]
      },
      "SecretName": {
        "type": "string",
        "minLength": 1,
        "maxLength": 127,
        "pattern": "^[a-zA-Z0-9-]+$",
        "description": "The KEY NAME of the secret in Key Vault — not the password value itself. Key Vault secret names allow only alphanumeric characters and hyphens.",
        "examples": ["d365-svc-password", "d365-prod-svc-password"]
      }
    }
  }
}
