[
  {
    "URL":        "https://contoso-prod1.crm.dynamics.com",
    "AKV":        "kv-d365-prod",
    "Username":   "svc_d365_prod@contoso.onmicrosoft.com",
    "SecretName": "d365-prod-svc-password"
  },
  {
    "URL":        "https://contoso-prod2.crm.dynamics.com",
    "AKV":        "kv-d365-prod",
    "Username":   "svc_d365_prod@contoso.onmicrosoft.com",
    "SecretName": "d365-prod-svc-password"
  },
  {
    "URL":        "https://contoso-prod3.crm4.dynamics.com",
    "AKV":        "kv-d365-prod-eu",
    "Username":   "svc_d365_eu@contoso.onmicrosoft.com",
    "SecretName": "d365-prod-eu-svc-password"
  }
]
