[
  {
    "URL":        "https://contoso-dev.crm.dynamics.com",
    "AKV":        "kv-d365-dev",
    "Username":   "svc_d365@contoso.onmicrosoft.com",
    "SecretName": "d365-svc-password"
  },
  {
    "URL":        "https://contoso-dev2.crm.dynamics.com",
    "AKV":        "kv-d365-dev",
    "Username":   "svc_d365@contoso.onmicrosoft.com",
    "SecretName": "d365-svc-password"
  },
  {
    "URL":        "https://contoso-uat.crm.dynamics.com",
    "AKV":        "kv-d365-dev",
    "Username":   "svc_d365_uat@contoso.onmicrosoft.com",
    "SecretName": "d365-uat-svc-password"
  }
]
